Ime|Srbija|Beograd|Serbian|4|poocetak|Kraj|9/2/1934|45|Beograd je glavni grad Srbije.
Marko|Holandija|Amsterdam|English|2|pocetak|kraj|1/2/2000|23|Amsterdam je glavni grad Holandije.
Luka|Italija|Milano|Serbian|3|pocetak|kraj|5/4/2020|14|Milano je glavni grad Italije.
Pavke|Engleska|London|English|9|osam|devet|7/6/2011|76|London je glavni grad Engleske.
Gagi|Rusija|Moskva|Serbian|5|sest|sedam|4/8/2001|14|Moskva je glavni grad Rusije.
Zlatko|Nemacka|Berlin|English|3|deset|devet|7/7/2004|27|Berlin je glavni grad Nemacke.